id,Category,question,options,correct_answer,correct_reasoning,system_answer,system_reasoning
81,Skin Diseases,What is acne caused by?,"{'A': 'Bacterial infection', 'B': 'Blocked skin follicles', 'C': 'Excessive sweating', 'D': 'Skin cancer'}",B,"Acne is caused by blocked skin follicles, which lead to oil, bacteria, and dead skin buildup.",B,"Acne is caused by blocked skin follicles, which lead to oil, bacteria, and dead skin buildup in the pores. This blockage results in the formation of pimples, blackheads, and whiteheads commonly associated with acne."
82,Skin Diseases,Which of the following skin diseases leads to hair loss in small patches?,"{'A': 'Psoriasis', 'B': 'Alopecia areata', 'C': 'Rosacea', 'D': 'Eczema'}",B,"Alopecia areata is a condition that causes hair loss in small patches, often affecting the scalp.",B,"The correct option is B: Alopecia areata. Alopecia areata is a common skin disease that leads to hair loss in small patches. Psoriasis, Rosacea, and Eczema do not typically cause hair loss in small patches."
83,Skin Diseases,"Which condition is characterized by dry, itchy skin leading to swelling and cracking?","{'A': 'Psoriasis', 'B': 'Atopic dermatitis (eczema)', 'C': 'Vitiligo', 'D': 'Rosacea'}",B,"Atopic dermatitis, also known as eczema, causes dry, itchy skin that can lead to swelling, cracking, or scaliness.",B,"The correct option is B: Atopic dermatitis (eczema). Atopic dermatitis is characterized by dry, itchy skin that leads to swelling and cracking. Psoriasis is described as scaly skin that may swell or feel hot. Vitiligo presents as patches of skin that lose pigment. Rosacea is flushed, thick skin and pimples usually on the face, which is different from the symptoms described in the question."
84,Skin Diseases,What is the condition where skin patches lose pigment?,"{'A': 'Vitiligo', 'B': 'Acne', 'C': 'Psoriasis', 'D': 'Rosacea'}",A,"Vitiligo is a condition in which patches of skin lose their pigment, leading to lighter skin areas.",A,"The correct answer is A: Vitiligo. Vitiligo is a condition where patches of skin lose pigment, resulting in white patches on the skin. This is mentioned in the document under the section 'Skin Diseases' as one of the types of skin diseases."
85,Skin Diseases,Which of the following skin diseases is rare and characterized by fragile skin that blisters easily?,"{'A': 'Actinic prurigo', 'B': 'Epidermolysis bullosa', 'C': 'Necrobiosis lipoidica', 'D': 'Harlequin ichthyosis'}",B,"Epidermolysis bullosa is a rare genetic disorder that causes fragile skin, which blisters and tears easily.",B,"The correct option is B: Epidermolysis bullosa. This rare skin disease is characterized by fragile skin that blisters and tears easily. Actinic prurigo (option A) is an itchy rash in response to sun exposure, Necrobiosis lipoidica (option C) is a rash on the lower legs that can develop into ulcers, and Harlequin ichthyosis (option D) is characterized by thick, hard patches or plates on the skin that are present at birth."
86,Skin Diseases,What is one common cause of skin diseases?,"{'A': 'Sun exposure', 'B': 'Lack of sleep', 'C': 'Cold weather', 'D': 'Drinking alcohol'}",A,"Sun exposure can lead to various skin conditions, including sunburn and skin cancer, which are common causes of skin diseases.",A,"One common cause of skin diseases is sun exposure. The document mentions that sun exposure can lead to skin diseases as it is listed under the causes of skin diseases. Sun exposure can cause damage to the skin, leading to conditions such as skin cancer, sunburn, and other sun-related skin issues."
87,Skin Diseases,Which test involves removing a small piece of skin to examine under a microscope?,"{'A': 'Culture', 'B': 'Biopsy', 'C': 'Skin patch test', 'D': 'Dermoscopy'}",B,A biopsy involves removing a small piece of skin tissue to examine it for potential skin diseases.,B,The correct option is B: Biopsy. A biopsy involves removing a small piece of skin to examine under a microscope. This test is commonly used to diagnose skin diseases when visual examination alone does not provide clear answers.
88,Skin Diseases,What is one way to prevent contagious skin diseases?,"{'A': 'Avoiding sun exposure', 'B': 'Not sharing personal items', 'C': 'Using moisturizers', 'D': 'Taking antibiotics'}",B,"Avoiding sharing personal items, such as cosmetics or towels, can help prevent the spread of contagious skin diseases.",B,"The correct option is B: Not sharing personal items. This is because contagious skin diseases can easily spread through sharing personal items such as towels, razors, or makeup. By avoiding sharing these items, you can reduce the risk of contracting contagious skin diseases."
89,Skin Diseases,"Which condition causes periodic reduced blood flow to fingers and toes, causing numbness and color change?","{'A': ""Raynaud's phenomenon"", 'B': 'Psoriasis', 'C': 'Alopecia areata', 'D': 'Eczema'}",A,"Raynaud's phenomenon is a condition that causes periodic reduced blood flow to the fingers, toes, or other body parts, leading to numbness or skin color change.",A,"The correct option is 'A: Raynaud's phenomenon'. This condition is characterized by periodic reduced blood flow to fingers, toes, or other body parts, leading to numbness and changes in skin color. It is a common condition that can worsen with stress, as mentioned in the provided document."
90,Lung Disease,What is the most common cause of chronic obstructive pulmonary disease (COPD)?,"{'A': 'Asthma', 'B': 'Smoking', 'C': 'Bacterial infection', 'D': 'Genetic mutation'}",B,"Smoking is the leading cause of chronic obstructive pulmonary disease (COPD), which causes long-term damage to the airways and alveoli.",B,The correct option is B: Smoking. Smoking is the most common cause of chronic obstructive pulmonary disease (COPD). It is a well-known risk factor for developing COPD and is responsible for a significant number of cases worldwide.
91,Lung Disease,What is the primary symptom of asthma?,"{'A': 'Wheezing', 'B': 'Coughing', 'C': 'Shortness of breath', 'D': 'Chest pain'}",A,"Wheezing is a common symptom of asthma due to inflammation and narrowing of the airways, which makes it difficult to breathe.",C,"The primary symptom of asthma is shortness of breath. While wheezing, coughing, and chest pain are also common symptoms of asthma, shortness of breath is typically the most prominent and characteristic symptom experienced by individuals with asthma."
92,Lung Disease,Which of the following is a common trigger for asthma symptoms?,"{'A': 'Dry air', 'B': 'Allergens', 'C': 'High blood pressure', 'D': 'Lung infections'}",B,"Allergens such as pollen, dust, or pet dander are common triggers for asthma symptoms due to inflammation in the airways.",B,"The correct option is B: Allergens. According to the provided information, exposure to allergens is a common trigger for asthma symptoms. Allergies can raise the risk of developing asthma, and substances like dust mites, mold, pet dander, and pollen can trigger asthma attacks in individuals with the condition."
93,Lung Disease,What is the characteristic feature of emphysema?,"{'A': 'Wheezing', 'B': 'Air trapping in the lungs', 'C': 'Inflammation of the pleura', 'D': 'Chronic wet cough'}",B,"Emphysema involves the destruction of alveolar walls, which causes air trapping in the lungs and difficulty expelling air.",B,"The characteristic feature of emphysema is air trapping in the lungs. Emphysema occurs when the fragile links between alveoli are damaged, leading to the trapping of air in the lungs. This results in difficulty blowing air out, which is a hallmark of emphysema."
94,Lung Disease,Which lung disease is commonly associated with coal dust exposure?,"{'A': 'Pulmonary edema', 'B': 'Pneumoconiosis', 'C': 'Asthma', 'D': 'Lung cancer'}",B,"Pneumoconiosis, including black lung disease, is caused by the inhalation of dust, such as coal dust, leading to lung damage.",B,"The correct option is B: Pneumoconiosis. Pneumoconiosis is a category of conditions caused by the inhalation of mineral dust particles, including coal dust. This lung disease is commonly associated with coal dust exposure, leading to lung tissue inflammation and scarring."
95,Lung Disease,What is the most common cause of pneumonia?,"{'A': 'Bacterial infection', 'B': 'Viral infection', 'C': 'Fungal infection', 'D': 'Allergens'}",A,"Bacterial infections, particularly by Streptococcus pneumoniae, are the most common cause of pneumonia.",A,"The most common cause of pneumonia is bacterial infection. In the provided document, it states that pneumonia is an infection of the alveoli, usually by bacteria or viruses, including the coronavirus that causes COVID-19."
96,Lung Disease,What is the primary cause of pulmonary embolism?,"{'A': 'Heart disease', 'B': 'Blood clot', 'C': 'Lung infection', 'D': 'Lung cancer'}",B,Pulmonary embolism is most commonly caused by a blood clot that travels to the lungs from deep vein thrombosis (DVT).,B,"The correct option is B: Blood clot. Pulmonary embolism is primarily caused by a blood clot that breaks off, travels to the heart, and gets pumped into the lungs, where it sticks in a pulmonary artery. This clot can lead to shortness of breath and low blood oxygen levels."
97,Lung Disease,Which condition involves inflammation and scarring of the lung tissue and is commonly linked to autoimmune diseases?,"{'A': 'Interstitial lung disease', 'B': 'Chronic bronchitis', 'C': 'Cystic fibrosis', 'D': 'Pulmonary hypertension'}",A,"Interstitial lung disease is a group of lung conditions, including sarcoidosis and idiopathic pulmonary fibrosis, that cause inflammation and scarring of lung tissue.",A,"The correct option is A: Interstitial lung disease. Interstitial lung disease involves inflammation and scarring of the lung tissue. It is commonly linked to autoimmune diseases, where the body's immune system mistakenly attacks healthy lung tissue. This condition can lead to progressive scarring of the lungs, affecting their ability to function properly."
98,Lung Disease,What is the primary treatment for chronic bronchitis?,"{'A': 'Antibiotics', 'B': 'Bronchodilators', 'C': 'Corticosteroids', 'D': 'Surgery'}",B,"Bronchodilators are often used to help open the airways and ease breathing in individuals with chronic bronchitis, a form of COPD.",B,"The primary treatment for chronic bronchitis is bronchodilators. Bronchodilators help relax the muscles around the airways, making it easier to breathe. They are commonly used to relieve symptoms of chronic bronchitis by opening up the airways and improving airflow."
99,Lung Disease,What is the main cause of pulmonary edema?,"{'A': 'Heart failure', 'B': 'Lung cancer', 'C': 'Pneumonia', 'D': 'Pulmonary embolism'}",A,"Pulmonary edema is often caused by heart failure, which leads to fluid buildup in the lungs' air sacs and interferes with normal breathing.",A,The main cause of pulmonary edema is heart failure. Pulmonary edema occurs when fluid leaks out of the small blood vessels of the lung into the air sacs and the area around them. One form of pulmonary edema is caused by heart failure and back pressure in the lungs' blood vessels.
