id,Category,question,options,correct_answer,correct_reasoning,system_answer,system_reasoning
38,Asthma,What should you do if you have a severe asthma attack?,"{'A': 'Use your rescue inhaler and seek medical help if needed', 'B': 'Wait for the symptoms to go away on their own', 'C': 'Take an over-the-counter cold medicine', 'D': 'Increase physical activity'}",A,"During a severe asthma attack, you should use your rescue inhaler immediately and seek emergency medical care if symptoms persist.",A,"The correct option is A: 'Use your rescue inhaler and seek medical help if needed.' This is the recommended action for a severe asthma attack according to the provided document. Using the rescue inhaler is the first step to open up your airways, and seeking medical help is crucial if the symptoms persist or worsen."
39,Asthma,Can asthma be cured?,"{'A': 'Yes, with medication', 'B': 'Yes, through surgery', 'C': 'No, but it can be managed', 'D': 'Yes, with physical therapy'}",C,"Asthma cannot be cured, but it can be managed through medication, lifestyle adjustments, and avoiding triggers.",C,"The correct option is C: No, but it can be managed. Asthma is a chronic condition that does not have a cure. However, it can be effectively managed with medications, lifestyle changes, and avoiding triggers. Surgery and physical therapy are not primary treatments for asthma."
40,Stroke,What is the primary cause of ischemic strokes?,"{'A': 'Bleeding in the brain', 'B': 'Blockage of blood vessels in the brain', 'C': 'Aneurysm in the brain', 'D': 'High blood pressure'}",B,"Ischemic strokes are caused by a blockage in the blood vessels of the brain, leading to a lack of blood flow and oxygen.",B,"The primary cause of ischemic strokes is the blockage of blood vessels in the brain, which cuts off blood flow and oxygen to the affected area. This lack of blood flow leads to cell damage and is the main mechanism behind ischemic strokes."
41,Stroke,What does the acronym BE FAST help you remember?,"{'A': 'The stages of stroke recovery', 'B': 'The emergency response steps for a heart attack', 'C': 'The symptoms of a stroke', 'D': 'The signs of a heart attack'}",C,"BE FAST helps to remember the key symptoms of a stroke: Balance, Eyes, Face, Arms, Speech, and Time.",C,"The correct option is C: The symptoms of a stroke. The acronym BE FAST helps you remember key symptoms related to balance, the eyes, face, arms, speech, and the importance of minimizing the time it takes to receive treatment for a stroke."
42,Stroke,What is a transient ischemic attack (TIA)?,"{'A': 'A stroke that lasts for a week', 'B': 'A type of hemorrhagic stroke', 'C': 'A mini-stroke with temporary effects', 'D': 'A severe headache caused by stroke'}",C,"A TIA, or mini-stroke, has temporary effects and is often a warning sign of a higher risk of a full stroke.",C,The correct option is C: A mini-stroke with temporary effects. A transient ischemic attack (TIA) is often referred to as a 'mini-stroke' because it has similar symptoms to a stroke but the effects are temporary. It serves as a warning sign that a person is at high risk of experiencing a true stroke in the near future.
43,Stroke,Which of the following is a primary risk factor for stroke?,"{'A': 'Sleep apnea', 'B': 'Obesity', 'C': 'High blood pressure', 'D': 'All of the above'}",D,"High blood pressure, obesity, and sleep apnea are all risk factors that increase the likelihood of having a stroke.",C,"The correct option is C: High blood pressure. High blood pressure is a primary risk factor for stroke as it can contribute to blood vessel damage, making a stroke more likely. While sleep apnea and obesity are also risk factors for stroke, high blood pressure plays a role in all types of strokes."
44,Stroke,What is the first treatment priority for an ischemic stroke?,"{'A': 'Surgery', 'B': 'Restoring blood flow', 'C': 'Managing blood pressure', 'D': 'Controlling bleeding'}",B,"For ischemic strokes, the primary treatment is restoring blood flow to the affected brain area to minimize damage.",B,"The correct option is B: Restoring blood flow. For ischemic strokes, the top priority is restoring circulation to affected brain areas. This is crucial in order to prevent permanent damage or limit the severity of the stroke. Restoring circulation usually involves a certain medication type called thrombolytics or a catheterization procedure."
45,Stroke,Which type of stroke involves bleeding inside the brain?,"{'A': 'Ischemic stroke', 'B': 'Hemorrhagic stroke', 'C': 'Transient ischemic attack', 'D': 'Cryptogenic stroke'}",B,"Hemorrhagic strokes involve bleeding inside or around the brain, leading to pressure on brain tissue.",B,"The correct option is B: Hemorrhagic stroke. Hemorrhagic strokes involve bleeding inside the brain, either intracerebral (bleeding inside the brain tissue) or into the subarachnoid space (the space between the brain and its outer covering). This type of stroke is characterized by the rupture of blood vessels in the brain, leading to bleeding and pressure on the surrounding brain tissue."
46,Stroke,What is a common symptom of a stroke related to the face?,"{'A': 'Blurred vision', 'B': 'Loss of coordination', 'C': 'Drooping on one side of the face', 'D': 'Sudden memory loss'}",C,A drooping face on one side is a common symptom of muscle weakness or paralysis in stroke patients.,C,"The correct option is C: Drooping on one side of the face. This is a common symptom of a stroke related to the face, known as facial droop or weakness. It occurs due to the loss of muscle control on one side of the face, which is a classic sign of a stroke affecting the facial nerves."
47,Stroke,What diagnostic test is commonly used to confirm a stroke?,"{'A': 'Electrocardiogram (ECG)', 'B': 'Magnetic resonance imaging (MRI)', 'C': 'Blood tests', 'D': 'Ultrasound'}",B,Magnetic resonance imaging (MRI) is commonly used to diagnose strokes by providing detailed images of the brain.,B,"The correct option is B: Magnetic resonance imaging (MRI). MRI scans are commonly used to confirm a stroke by providing detailed images of the brain, which can show areas of reduced blood flow or bleeding. While other tests like blood tests and electrocardiograms may be done to rule out other conditions or assess risk factors, MRI is the preferred imaging modality for diagnosing a stroke."
48,Stroke,What is the purpose of thrombolytic drugs in ischemic stroke treatment?,"{'A': 'To reduce brain pressure', 'B': 'To dissolve blood clots', 'C': 'To control blood sugar', 'D': 'To stop brain bleeding'}",B,Thrombolytic drugs dissolve blood clots and help restore circulation to the affected brain area during an ischemic stroke.,B,"The purpose of thrombolytic drugs in ischemic stroke treatment is to dissolve blood clots. Thrombolytic drugs are medications that dissolve existing clots, helping to restore circulation to affected brain areas and prevent permanent damage or limit the severity of the stroke."
49,Stroke,What lifestyle change can help reduce the risk of stroke?,"{'A': 'Smoking cessation', 'B': 'Regular exercise', 'C': 'Healthy diet', 'D': 'All of the above'}",D,"Smoking cessation, regular exercise, and a healthy diet are all effective ways to reduce stroke risk.",D,"The correct option is D: All of the above. Smoking cessation, regular exercise, and a healthy diet are all lifestyle changes that can help reduce the risk of stroke. Smoking and tobacco use, lack of exercise, and poor diet are all risk factors for stroke, so making these lifestyle changes can significantly lower the risk of having a stroke."
50,Breast Cancer,What is the most common type of breast cancer in the United States?,"{'A': 'Lobular breast cancer', 'B': 'Invasive (infiltrating) ductal carcinoma (IDC)', 'C': 'Triple-negative breast cancer (TNBC)', 'D': 'Paget’s disease of the breast'}",B,"Invasive ductal carcinoma (IDC) is the most common type of breast cancer in the United States, starting in the milk ducts and spreading to nearby breast tissue.",B,"The most common type of breast cancer in the United States is Invasive (infiltrating) ductal carcinoma (IDC), as mentioned in the provided document. IDC starts in the milk ducts and spreads to nearby breast tissue."
51,Breast Cancer,Which of the following is a less common type of breast cancer?,"{'A': 'Lobular breast cancer', 'B': 'Inflammatory breast cancer (IBC)', 'C': 'Invasive (infiltrating) ductal carcinoma (IDC)', 'D': 'Ductal carcinoma in situ (DCIS)'}",B,"Inflammatory breast cancer (IBC) is rare and grows quickly, often appearing like a rash on the breast.",B,"Inflammatory breast cancer (IBC) is a less common type of breast cancer as mentioned in the provided document. It is described as a rare, fast-growing cancer that looks like a rash on the breast. In contrast, Lobular breast cancer and Ductal carcinoma in situ (DCIS) are more common types of breast cancer, while Invasive (infiltrating) ductal carcinoma (IDC) is the most common type."
52,Breast Cancer,What does it mean if breast cancer is classified as HR-positive?,"{'A': 'The cancer cells have estrogen and progesterone receptors.', 'B': 'The cancer cells have HER2 protein.', 'C': 'The cancer cells don’t have estrogen or progesterone receptors.', 'D': 'The cancer cells do not spread to other parts of the body.'}",A,"HR-positive breast cancers have estrogen and progesterone receptors, which help cancer cells to grow when these hormones are present.",A,"If breast cancer is classified as HR-positive, it means that the cancer cells have estrogen and progesterone receptors. HR-positive (HR+) breast cancers specifically refer to those that have both estrogen and progesterone receptors present on their surfaces."
53,Breast Cancer,At what age is breast cancer most likely to affect women and people AFAB?,"{'A': 'Under age 30', 'B': 'Between ages 30 and 40', 'C': '50 and older', 'D': 'Between ages 40 and 50'}",C,"Breast cancer typically affects women and people AFAB age 50 and older, but it can also affect younger individuals.",C,"Breast cancer typically affects women age 50 and older, but it can also affect women and people AFAB who are younger than 50. Therefore, the most likely age range for breast cancer to affect women and people AFAB is 50 and older."
54,Breast Cancer,What is a common symptom of breast cancer?,"{'A': 'Pain in the back', 'B': 'A lump or thickening in or near the breast or underarm', 'C': 'Frequent headaches', 'D': 'Difficulty breathing'}",B,A lump or thickening in or near the breast or underarm that persists through the menstrual cycle is a common symptom of breast cancer.,B,"The correct option is B: A lump or thickening in or near the breast or underarm. This is a common symptom of breast cancer as mentioned in the document. Other symptoms may include changes in the size, shape, or contour of the breast, changes in the skin on the breast or nipple, and blood-stained or clear fluid discharge from the nipple."
55,Breast Cancer,Which of the following is a risk factor for developing breast cancer?,"{'A': 'Being under age 30', 'B': 'Family history of breast cancer', 'C': 'Lack of physical activity', 'D': 'Consuming only plant-based foods'}",B,"Having a family history of breast cancer increases the risk of developing the condition, as inherited genetic mutations are a known risk factor.",B,"The correct option is B: Family history of breast cancer. This is a known risk factor for developing breast cancer, as mentioned in the provided document. Having parents, siblings, children, or other close relatives with breast cancer increases the individual's risk of developing the disease."
56,Breast Cancer,What does a breast cancer stage of Stage IV indicate?,"{'A': 'The cancer is localized to the breast.', 'B': 'The cancer has spread to nearby tissue and lymph nodes.', 'C': 'The cancer has spread to distant areas such as bones, liver, or lungs.', 'D': 'The cancer is in situ and hasn’t spread.'}",C,"Stage IV indicates metastatic breast cancer, where the cancer has spread to distant areas such as bones, liver, or lungs.",C,"A breast cancer stage of Stage IV indicates that the cancer has spread from the breast to distant areas such as bones, liver, lungs, or brain. This is known as metastatic breast cancer, where the cancer has advanced beyond the breast and nearby tissues."
57,Breast Cancer,Which breast cancer subtype is associated with higher levels of the HER2 protein?,"{'A': 'HR-negative', 'B': 'HER2-positive', 'C': 'ER-positive', 'D': 'PR-positive'}",B,"HER2-positive breast cancers have higher than normal levels of the HER2 protein, which helps cancer cells grow.",B,"The correct answer is B: HER2-positive. This subtype of breast cancer is associated with higher than normal levels of the HER2 protein, which helps cancer cells to grow. Approximately 15% to 20% of all breast cancers are HER2-positive."
58,Breast Cancer,What is a possible complication of breast cancer surgery?,"{'A': 'Hair loss', 'B': 'Nerve damage', 'C': 'Vision loss', 'D': 'Memory loss'}",B,"Nerve damage is a possible complication of breast cancer surgery, along with other risks such as infection and blood clots.",B,"The correct option is B: Nerve damage. According to the provided document, potential complications of breast cancer surgery may include nerve damage. This is a known risk associated with surgical procedures involving the breast."
59,Breast Cancer,What is one way to lower the risk of breast cancer?,"{'A': 'Smoking', 'B': 'Regular physical activity', 'C': 'Eating a high-fat diet', 'D': 'Drinking alcohol daily'}",B,Regular physical activity has been shown to lower the risk of developing breast cancer.,B,"The correct option to lower the risk of breast cancer is B: Regular physical activity. Studies show that regular physical activity lowers breast cancer risk, as mentioned in the provided document from the American Cancer Society."
60,Migraine,What is a migraine?,"{'A': 'A type of stress-related condition', 'B': 'A severe headache with throbbing, pulsing pain', 'C': 'A headache caused by dehydration', 'D': 'A tension headache'}",B,"A migraine is a severe headache that causes throbbing, pulsing head pain, usually on one side of the head.",B,"The correct option is B: A severe headache with throbbing, pulsing pain. This is because the provided document clearly states that a migraine is a severe headache that causes throbbing, pulsing head pain on one side of your head. It also mentions that migraines can last for days and are worsened by physical activity, bright lights, loud noises, and strong odors."
61,Migraine,How long does the headache phase of a migraine usually last?,"{'A': 'One hour', 'B': 'Four hours to 72 hours', 'C': 'A few minutes', 'D': 'One week'}",B,The headache phase of a migraine usually lasts at least four hours but can last up to 72 hours.,B,"The correct option is B: Four hours to 72 hours. According to the provided information, the headache phase of a migraine usually lasts between four hours to 72 hours."
62,Migraine,What is the first phase of a migraine?,"{'A': 'Aura', 'B': 'Headache', 'C': 'Prodrome', 'D': 'Postdrome'}",C,"The first phase of a migraine is called the prodrome, which can begin up to 24 hours before the headache.",C,"The correct answer is C: Prodrome. The first phase of a migraine is the prodrome phase, which begins up to 24 hours before experiencing a headache. During this phase, individuals may experience symptoms such as mood changes, difficulty concentrating, trouble sleeping, fatigue, nausea, increased hunger and thirst, frequent urination, among others."
63,Migraine,Which of the following is NOT a phase of a migraine?,"{'A': 'Prodrome', 'B': 'Aura', 'C': 'Postdrome', 'D': 'Interdrome'}",D,"The phases of a migraine include prodrome, aura, headache, and postdrome. There is no phase called 'interdrome.'",D,"The correct option is D: Interdrome. Interdrome is not a phase of a migraine. The phases of a migraine include Prodrome, Aura, Headache, and Postdrome as described in the provided information."
64,Migraine,Which migraine symptom occurs in the postdrome phase?,"{'A': 'Muscle weakness', 'B': 'Numbness and tingling', 'C': 'Fatigue', 'D': 'Vision changes'}",C,"Fatigue is a common symptom in the postdrome phase, which can also feel similar to an alcohol-induced hangover.",C,"The correct option is C: Fatigue. According to the provided document, fatigue is a symptom that occurs in the postdrome phase of a migraine. Other symptoms in the postdrome phase include a stiff neck, sensitivity to light and sound, difficulty concentrating, nausea, and dizziness."
65,Migraine,What is the common duration of a migraine headache?,"{'A': 'Less than one hour', 'B': 'One to two hours', 'C': 'Four hours to 72 hours', 'D': 'A week'}",C,A migraine headache typically lasts from four hours to 72 hours.,C,"The correct option is C: Four hours to 72 hours. According to the provided document, a migraine headache typically lasts between four hours to 72 hours."
66,Migraine,What is the most common type of migraine?,"{'A': 'Migraine with aura', 'B': 'Migraine without aura', 'C': 'Menstrual migraine', 'D': 'Chronic migraine'}",B,Migraine without aura (common migraine) is the most prevalent type of migraine.,B,The most common type of migraine is Migraine without aura (common migraine). This is supported by the information provided in the document which states that the most common migraine categories are Migraine with aura and Migraine without aura.
67,Migraine,Which of the following is a known trigger for migraines?,"{'A': 'Bright lights', 'B': 'Physical activity', 'C': 'Loud noises', 'D': 'All of the above'}",D,"Bright lights, physical activity, and loud noises are all common migraine triggers.",D,"The correct option is D: All of the above. Bright lights, physical activity, and loud noises are all common triggers for migraines according to the provided document. Migraine triggers can vary from person to person, but these factors are commonly reported triggers."
68,Migraine,What percentage of people with migraines have a first-degree relative with the condition?,"{'A': '10%', 'B': '20%', 'C': '50%', 'D': 'Up to 80%'}",D,Up to 80% of people with migraines have a first-degree biological relative with the condition.,D,"The correct answer is D: Up to 80%. According to the provided document, up to 80% of people with migraines have a first-degree biological relative with the condition. This indicates a strong genetic component in the development of migraines."
69,Migraine,Which of the following medications is commonly used to stop a migraine?,"{'A': 'Beta-blockers', 'B': 'Triptans', 'C': 'Antiseizure medications', 'D': 'Monoclonal antibodies'}",B,Triptans are commonly used medications to stop a migraine when it begins.,B,"The correct option is B: Triptans. Triptans are commonly used medications to stop migraines. They work by narrowing blood vessels and reducing inflammation in the brain, which helps to alleviate migraine symptoms."
70,Celiac Disease,What triggers the immune system response in people with celiac disease?,"{'A': 'Bacterial infections', 'B': 'Gluten', 'C': 'Vitamin deficiencies', 'D': 'High blood pressure'}",B,"Gluten triggers an immune system response in people with celiac disease, causing damage to the small intestine.",B,"The correct option is B: Gluten. In people with celiac disease, gluten in the small intestine triggers an immune response. The immune system produces antibodies against gluten, which then damage the lining of the small intestine. This immune response is what leads to the symptoms and complications of celiac disease."
71,Celiac Disease,What is the primary function of the small intestine that is affected by celiac disease?,"{'A': 'Production of digestive enzymes', 'B': 'Absorption of nutrients', 'C': 'Production of bile', 'D': 'Absorption of oxygen'}",B,"The primary function of the small intestine is nutrient absorption, which is impaired in celiac disease due to damage to the mucosa.",B,"The correct option is B: Absorption of nutrients. Celiac disease affects the small intestine by damaging the mucosa lining, which impairs its ability to absorb nutrients from food. This leads to malabsorption and can result in nutritional deficiencies."
72,Celiac Disease,Which of the following is NOT a common symptom of celiac disease?,"{'A': 'Stomach pain', 'B': 'Fatigue', 'C': 'Bloating', 'D': 'Excessive thirst'}",D,"Excessive thirst is not a typical symptom of celiac disease, whereas stomach pain, fatigue, and bloating are common.",D,"Excessive thirst is NOT a common symptom of celiac disease. Common symptoms of celiac disease include stomach pain, fatigue, bloating, and other gastrointestinal symptoms. Excessive thirst is not typically associated with celiac disease."
73,Celiac Disease,What gene mutations are commonly associated with celiac disease?,"{'A': 'BRCA1 and BRCA2', 'B': 'HLA-DQ2 and HLA-DQ8', 'C': 'APOE4', 'D': 'TP53'}",B,The gene mutations HLA-DQ2 and HLA-DQ8 are commonly associated with celiac disease.,B,"The correct option is B: HLA-DQ2 and HLA-DQ8. According to the provided information, about 97% of people diagnosed with celiac disease have a recognizable gene mutation associated with it, specifically HLA-DQ2 or HLA-DQ8."
74,Celiac Disease,What is the most important part of treating celiac disease?,"{'A': 'Taking corticosteroids', 'B': 'Starting a gluten-free diet', 'C': 'Receiving regular blood transfusions', 'D': 'Engaging in regular exercise'}",B,The most important treatment for celiac disease is maintaining a strict gluten-free diet to prevent further immune system damage.,B,"The most important part of treating celiac disease is starting a gluten-free diet. This is because celiac disease is triggered by gluten consumption, and the only way to prevent the reaction and allow the small intestine to heal is by completely avoiding gluten. Corticosteroids, regular blood transfusions, and regular exercise are not primary treatments for celiac disease."
75,Celiac Disease,At what age is celiac disease most commonly diagnosed?,"{'A': 'Early childhood (8-12 months)', 'B': 'Adolescence (13-18 years)', 'C': 'Mid-life (40-60 years)', 'D': 'Late adulthood (60+ years)'}",A,"Celiac disease is commonly diagnosed in early childhood, typically when solid foods containing gluten are introduced.",C,"Celiac disease is most commonly diagnosed in mid-life, between the ages of 40 and 60, as mentioned in the provided document. While it can appear at any age after consuming gluten, the two distinct age windows where healthcare providers most commonly see it are early childhood (8-12 months) and mid-life (40-60 years)."
76,Celiac Disease,What chronic skin condition is associated with celiac disease?,"{'A': 'Psoriasis', 'B': 'Dermatitis herpetiformis', 'C': 'Eczema', 'D': 'Rosacea'}",B,"Dermatitis herpetiformis, also known as the 'gluten rash,' is a chronic skin condition associated with celiac disease.",B,"The correct option is B: Dermatitis herpetiformis. This chronic skin condition is associated with celiac disease and is also known as the 'gluten rash' or the 'celiac rash.' It manifests as an itchy rash that looks like clusters of bumps or blisters and typically affects areas such as the elbows, knees, buttocks, or scalp."
77,Celiac Disease,Which of the following is a common complication of untreated celiac disease?,"{'A': 'Hypertension', 'B': 'Osteoporosis', 'C': 'Asthma', 'D': 'Liver failure'}",B,Osteoporosis is a common complication of untreated celiac disease due to malabsorption of calcium and other nutrients.,B,"The correct option is B: Osteoporosis. Untreated celiac disease can lead to chronic malnutrition, which can result in complications such as osteoporosis. Chronic inflammation and malabsorption of nutrients can affect bone health, leading to conditions like osteoporosis."
78,Celiac Disease,What is the primary cause of damage to the small intestine in people with celiac disease?,"{'A': 'Bacterial infections', 'B': 'Immune system attack triggered by gluten', 'C': 'Lack of stomach acid', 'D': 'Poor blood circulation'}",B,"The immune system attacks the small intestine in response to gluten, causing damage to the mucosa.",B,"The correct option is B: Immune system attack triggered by gluten. In people with celiac disease, gluten in the small intestine triggers an immune response. The immune system sends inflammatory cells and antibodies to destroy the gluten molecules, leading to damage to the mucous membrane lining the small intestine."
79,Celiac Disease,Which of the following foods typically contains gluten and should be avoided by individuals with celiac disease?,"{'A': 'Rice', 'B': 'Corn', 'C': 'Wheat', 'D': 'Potatoes'}",C,"Wheat contains gluten, which triggers a response in individuals with celiac disease.",C,"The correct option is C: Wheat. Wheat is a grain that contains gluten, which triggers an immune response in individuals with celiac disease. Therefore, individuals with celiac disease should avoid foods containing wheat to prevent symptoms and damage to their small intestine."
80,Skin Diseases,What is the largest organ in the human body?,"{'A': 'Heart', 'B': 'Liver', 'C': 'Skin', 'D': 'Lungs'}",C,"The skin is the largest organ in the human body, covering and protecting the body.",C,"The correct option is C: Skin. According to the provided document 'Skin Diseases.pdf', the skin is described as the largest organ that covers and protects the body. It plays various functions such as holding in fluid, preventing dehydration, helping feel sensations, keeping out infections, stabilizing body temperature, and synthesizing vitamin D in response to sun exposure."
