id,Category,question,options,correct_answer,correct_reasoning,system_answer,system_reasoning
0,First Aid,What does the 'D' in DRSABCD stand for in first aid?,"{'A': 'Defibrillator', 'B': 'Danger', 'C': 'Diagnosis', 'D': 'Decision-making'}",B,"The 'D' in DRSABCD stands for Danger, which involves checking for danger to you, any bystanders, and the injured person before providing assistance.",B,"The correct option is B: Danger. In the DRSABCD action plan in first aid, the ""D"" stands for Danger. This step involves checking the danger to yourself, any bystanders, and then the injured or ill person before providing assistance."
1,First Aid,"If a person is unconscious and not breathing, what is the first step in performing CPR?","{'A': 'Call triple zero (000)', 'B': 'Check for airway obstruction', 'C': 'Perform chest compressions', 'D': 'Tilt their head back and give breaths'}",C,"For unconscious individuals not breathing, CPR involves starting with chest compressions. This ensures blood flow to vital organs.",B,"The correct option is B: Check for airway obstruction. When a person is unconscious and not breathing, the first step in performing CPR is to ensure their airway is clear. This involves checking for any obstructions in the airway that may be preventing the person from breathing. Only after confirming that the airway is clear should chest compressions and rescue breaths be initiated."
2,First Aid,What is the correct action when someone is choking and their airway is not clear?,"{'A': 'Perform a chest thrust', 'B': 'Roll them onto their side', 'C': 'Apply an AED', 'D': 'Perform CPR immediately'}",B,"If a person's airway is not clear and they are choking, rolling them onto their side is necessary to prioritize airway clearance.",B,"The correct action when someone is choking and their airway is not clear is to roll them onto their side. This helps in clearing the airway and preventing further obstruction, allowing the person to breathe. Performing a chest thrust, applying an AED, or performing CPR immediately are not recommended actions for a choking individual with an unclear airway."
3,First Aid,What is the main purpose of a defibrillator in first aid?,"{'A': 'To restart a stopped heart', 'B': 'To cancel irregular heartbeats and restore normal rhythm', 'C': 'To ensure blood circulation', 'D': 'To provide oxygen to the brain'}",B,An automated external defibrillator (AED) delivers an electrical shock to cancel arrhythmia and help re-establish a normal heartbeat.,B,"The correct option is B: To cancel irregular heartbeats and restore normal rhythm. A defibrillator is used to deliver an electrical shock to cancel any irregular heart beat (arrhythmia) in an effort to get the normal heart beating to re-establish itself. This helps restore the normal rhythm of the heart, rather than simply restarting a stopped heart."
4,First Aid,What should you do if a bleeding wound has an embedded object?,"{'A': 'Remove the object immediately', 'B': 'Apply pressure around the wound', 'C': 'Clean the wound thoroughly', 'D': 'Bandage tightly over the object'}",B,"For heavily bleeding wounds with embedded objects, apply pressure around the wound without dislodging the object.",B,"The correct option is B: Apply pressure around the wound. According to the provided information, when a bleeding wound has an embedded object, the immediate action should be to apply pressure around the wound. This helps to control the bleeding until medical help arrives. Removing the object immediately can worsen the bleeding, cleaning the wound thoroughly may dislodge the object and cause more bleeding, and bandaging tightly over the object can also exacerbate the situation."
5,First Aid,How can you check if a bandage is too tight?,"{'A': 'Ensure the bandage feels firm', 'B': 'Check for swelling', 'C': 'Press on a fingernail or toenail and observe the return of pink color', 'D': ""Ensure the bandage doesn't move""}",C,"To check if a bandage is too tight, press on a fingernail or toenail. If pink color returns within seconds, circulation is adequate.",C,"The correct option is C: Press on a fingernail or toenail and observe the return of pink color. According to the provided information, if the pink color returns within a couple of seconds after pressing on a fingernail or toenail of the injured limb, the bandage isn’t affecting the person’s circulation. This method helps in determining if the bandage is too tight and may be compromising blood flow."
6,First Aid,What should you do immediately after assessing that a person is unconscious but breathing?,"{'A': 'Perform chest compressions', 'B': 'Administer a defibrillator', 'C': 'Turn them onto their side', 'D': 'Call triple zero (000)'}",C,"For an unconscious but breathing person, turn them onto their side to maintain an open airway and prevent choking.",C,The correct option is to turn the person onto their side. This is important to ensure their airway remains clear and to prevent any potential choking. It also helps in maintaining their breathing while waiting for further medical assistance.
7,First Aid,Which of the following is recommended to reduce the risk of infection when treating a wound?,"{'A': 'Wash hands or use an antibacterial hand sanitiser', 'B': 'Cover the wound with a towel', 'C': 'Apply pressure to the wound', 'D': 'Avoid touching the wound directly'}",A,Washing hands or using an antibacterial hand sanitiser helps reduce the risk of infection when managing a wound.,A,The correct option is A: Wash hands or use an antibacterial hand sanitiser. This is recommended in the provided document as a suggestion to reduce the risk of infection when treating a wound. Proper hand hygiene is essential to prevent introducing harmful bacteria to the wound.
8,First Aid,What is the recommended depth of chest compressions during adult CPR?,"{'A': 'One quarter of the chest depth', 'B': 'One third of the chest depth', 'C': 'Half the chest depth', 'D': 'Full chest depth'}",B,Chest compressions during CPR should compress the chest to one third of its depth to ensure effective circulation.,B,"The recommended depth of chest compressions during adult CPR is one third of the chest depth. This is mentioned in the provided document where it states to press down firmly and smoothly, compressing to one third of their chest depth, 30 times."
9,First Aid,Why should you carry a resuscitation mask when performing CPR?,"{'A': 'To prevent transmission of infections', 'B': 'To provide better airflow', 'C': 'To ensure oxygen supply', 'D': 'To improve chest compressions'}",A,A resuscitation mask reduces the risk of infection transmission when performing mouth-to-mouth resuscitation.,A,The correct option is A: To prevent transmission of infections. Carrying a resuscitation mask when performing CPR helps to avoid contact with potentially infectious bodily fluids such as blood or saliva. This reduces the risk of transmitting infections while providing emergency assistance.
10,Heart Disease,What is the most common type of heart disease?,"{'A': 'Arrhythmia', 'B': 'Dilated cardiomyopathy', 'C': 'Coronary artery disease', 'D': 'Congenital heart defects'}",C,"Coronary artery disease is the most common type of heart disease, affecting the arteries that supply blood to the heart.",C,"The correct answer is C: Coronary artery disease. According to the provided document, coronary artery disease, also known as coronary heart disease, is the most common type of heart disease. It develops when the arteries that supply blood to the heart become clogged with plaque, leading to hardening and narrowing of the arteries."
11,Heart Disease,Which of the following is a potential risk factor for heart disease?,"{'A': 'Regular exercise', 'B': 'High cholesterol', 'C': 'Balanced diet', 'D': 'Low stress levels'}",B,"High cholesterol is a known risk factor for heart disease, as it can contribute to the buildup of plaque in the arteries.",B,"High cholesterol is a potential risk factor for heart disease according to the provided document. It mentions that high cholesterol can increase the risk of heart disease, along with other factors such as high blood pressure, smoking, and obesity."
12,Heart Disease,What is a common symptom of a heart attack?,"{'A': 'Chest pain', 'B': 'Nausea', 'C': 'Sweating', 'D': 'All of the above'}",D,"Chest pain, nausea, and sweating are all common symptoms that may occur during a heart attack.",D,"The correct option is D: All of the above. Chest pain, nausea, and sweating are all common symptoms of a heart attack, as mentioned in the document. Other symptoms include breathlessness, heart palpitations, stomach pain, arm, jaw, back, or leg pain, a choking sensation, swollen ankles, fatigue, and an irregular heartbeat."
13,Heart Disease,Which medication class can help prevent blood clots in heart disease?,"{'A': 'Beta-blockers', 'B': 'Anticoagulants', 'C': 'Cholesterol-lowering medications', 'D': 'Diuretics'}",B,"Anticoagulants, also known as blood thinners, can help prevent the formation of blood clots, reducing the risk of heart attack and stroke.",B,"The correct option is B: Anticoagulants. Anticoagulants, also known as blood thinners, are medications that can prevent clots in heart disease. They include warfarin (Coumadin) and other direct oral anticoagulants like dabigatran, rivaroxaban, and apixaban."
14,Heart Disease,Which heart condition is associated with a rapidly beating heart?,"{'A': 'Bradycardia', 'B': 'Tachycardia', 'C': 'Atrial fibrillation', 'D': 'Heart failure'}",B,Tachycardia refers to an abnormally rapid heartbeat.,B,"The correct option is B: Tachycardia. Tachycardia refers to a rapid heartbeat, which is characterized by the heart beating too quickly. This condition is associated with an abnormally fast heart rate, unlike bradycardia (slow heartbeat), atrial fibrillation (irregular heartbeat), or heart failure (heart not working as well as it should be). Therefore, tachycardia is the heart condition associated with a rapidly beating heart."
15,Heart Disease,What is the primary cause of a heart attack?,"{'A': 'Plaque buildup and blood clot in a coronary artery', 'B': 'Infection in the heart', 'C': 'Weak heart muscles', 'D': 'High blood pressure'}",A,"The most common cause of a heart attack is the buildup of plaque and a blood clot in a coronary artery, restricting blood flow to the heart muscle.",A,"The correct option is A: Plaque buildup and blood clot in a coronary artery. According to the provided document, the most common cause of a heart attack is plaque, a blood clot, or both in a coronary artery. This can lead to a blockage in the artery, reducing blood supply to the heart muscle and potentially causing a heart attack."
16,Heart Disease,Which condition is characterized by the thickening of the heart muscle walls?,"{'A': 'Hypertrophic cardiomyopathy', 'B': 'Congenital heart defects', 'C': 'Coronary artery disease', 'D': 'Aortic stenosis'}",A,"Hypertrophic cardiomyopathy involves the thickening of the heart muscle walls, which can affect the heart's ability to pump blood.",A,"The correct option is A: Hypertrophic cardiomyopathy. This condition is characterized by the thickening of the heart muscle walls, which can affect the heart's ability to pump blood efficiently. It is an inherited condition that can lead to various heart problems over time."
17,Heart Disease,What is the main risk of arrhythmias?,"{'A': 'Blood clots', 'B': 'Increased heart rate', 'C': 'Irregular heartbeat that could lead to heart failure', 'D': 'Heart valve issues'}",C,Arrhythmias involve irregular heartbeats that can lead to complications like heart failure or stroke.,C,"The main risk of arrhythmias is an irregular heartbeat that could lead to heart failure. Arrhythmias refer to an irregular heartbeat where the electrical impulses coordinating the heartbeat do not work correctly. This can result in the heart beating too quickly, too slowly, or erratically, which can eventually lead to heart failure."
18,Heart Disease,What does heart failure refer to?,"{'A': 'The heart stops beating', 'B': ""The heart's ability to pump blood is impaired"", 'C': 'Excessive heart rate', 'D': 'An increase in blood pressure'}",B,"Heart failure occurs when the heart becomes weak and cannot pump blood effectively, though it may continue to beat.",B,"Heart failure refers to the heart's ability to pump blood being impaired. This is when the heart is still working but not as well as it should be, leading to problems with the pumping or relaxing function."
19,Heart Disease,Which of these lifestyle changes can help reduce the risk of heart disease?,"{'A': 'Regular physical activity', 'B': 'Smoking', 'C': 'High alcohol intake', 'D': 'Eating processed foods'}",A,"Regular physical activity can help improve heart health, reduce cholesterol, and manage blood pressure, all of which reduce the risk of heart disease.",A,"The correct option is A: Regular physical activity. This is because exercising regularly can help strengthen the heart and circulatory system, reduce cholesterol, and maintain blood pressure. It is mentioned in the document that aiming for 150 minutes of exercise per week can help reduce the risk of heart disease."
20,Diabetes,What is the most common type of diabetes?,"{'A': 'Type 1 diabetes', 'B': 'Type 2 diabetes', 'C': 'Gestational diabetes', 'D': 'Maturity-onset diabetes of the young (MODY)'}",B,"Type 2 diabetes is the most common form, affecting the majority of people with diabetes.",B,"The most common type of diabetes is Type 2 diabetes, as mentioned in the provided document. It states that Type 2 diabetes is the most common type of diabetes, affecting mainly adults but can also occur in children."
21,Diabetes,What is the main cause of Type 2 diabetes?,"{'A': 'Autoimmune response', 'B': 'Insulin resistance', 'C': 'Genetic mutations', 'D': 'Pancreatic damage'}",B,"Type 2 diabetes primarily results from insulin resistance, where the body’s cells don’t respond properly to insulin.",B,"The main cause of Type 2 diabetes is insulin resistance. Insulin resistance occurs when cells in the muscles, fat, and liver do not respond properly to insulin. This leads to high blood sugar levels as the body is unable to effectively regulate glucose. Factors contributing to insulin resistance include obesity, lack of physical activity, diet, hormonal imbalances, genetics, and certain medications."
22,Diabetes,Which of the following is a symptom of diabetes?,"{'A': 'Increased thirst', 'B': 'Low blood sugar', 'C': 'Weight gain', 'D': 'Nausea'}",A,"Increased thirst is one of the common symptoms of diabetes, especially when blood glucose levels are high.",A,"Increased thirst is a symptom of diabetes, as mentioned in the document. It is listed as one of the symptoms of diabetes along with dry mouth, frequent urination, fatigue, blurred vision, unexplained weight loss, numbness or tingling in hands or feet, slow-healing sores or cuts, and frequent skin and/or vaginal yeast infections."
23,Diabetes,What is prediabetes?,"{'A': 'A stage of Type 1 diabetes', 'B': 'High blood sugar not yet at diabetes levels', 'C': 'Type 2 diabetes that develops during pregnancy', 'D': 'A rare form of diabetes'}",B,Prediabetes refers to a condition where blood sugar levels are higher than normal but not high enough to be diagnosed as Type 2 diabetes.,B,The correct option is B: High blood sugar not yet at diabetes levels. Prediabetes is the stage before Type 2 diabetes where blood glucose levels are higher than normal but not high enough to be officially diagnosed with Type 2 diabetes.
24,Diabetes,What is the main difference between Type 1 and Type 2 diabetes?,"{'A': 'Type 1 is autoimmune, while Type 2 is caused by insulin resistance', 'B': 'Type 1 occurs only in adults, while Type 2 is only in children', 'C': 'Type 1 is more common than Type 2', 'D': 'Type 2 requires insulin from the beginning, while Type 1 does not'}",A,"Type 1 diabetes is an autoimmune disease where the immune system attacks the insulin-producing cells in the pancreas, while Type 2 diabetes is primarily caused by insulin resistance.",A,"The correct option is A: Type 1 is autoimmune, while Type 2 is caused by insulin resistance. This is supported by the information provided in the document, which states that Type 1 diabetes is an autoimmune disease where the immune system attacks insulin-producing cells, while Type 2 diabetes is characterized by the body not making enough insulin and/or cells not responding normally to insulin (insulin resistance). Therefore, the main difference between Type 1 and Type 2 diabetes lies in their underlying causes."
25,Diabetes,Which type of diabetes is most commonly diagnosed during pregnancy?,"{'A': 'Gestational diabetes', 'B': 'Type 1 diabetes', 'C': 'Type 2 diabetes', 'D': 'Type 3c diabetes'}",A,"Gestational diabetes develops during pregnancy and typically resolves after childbirth, although it increases the risk of developing Type 2 diabetes later in life.",A,"The correct answer is A: Gestational diabetes. Gestational diabetes is the type of diabetes most commonly diagnosed during pregnancy, as mentioned in the provided document. It develops in some people during pregnancy and usually goes away after pregnancy. Therefore, it is the most relevant type of diabetes in the context of pregnancy."
26,Diabetes,Which of the following conditions can lead to Type 3c diabetes?,"{'A': 'Autoimmune destruction of the pancreas', 'B': 'Pancreatic damage from conditions like pancreatitis', 'C': 'Insulin resistance', 'D': 'Gestational diabetes'}",B,"Type 3c diabetes occurs when the pancreas is damaged by conditions like pancreatitis or pancreatic cancer, affecting its ability to produce insulin.",B,"Pancreatic damage from conditions like pancreatitis can lead to Type 3c diabetes. The document mentions that Type 3c diabetes happens when the pancreas experiences damage (other than autoimmune damage), which affects its ability to produce insulin. Conditions like pancreatitis, pancreatic cancer, cystic fibrosis, and hemochromatosis can all lead to pancreas damage that causes Type 3c diabetes."
27,Diabetes,What is the most common complication of long-term diabetes?,"{'A': 'Nerve damage', 'B': 'Hypoglycemia', 'C': 'Heart disease', 'D': 'Kidney failure'}",C,"Cardiovascular issues, such as heart disease, are the most common long-term complications of diabetes due to damage to blood vessels.",C,"The correct option is C: Heart disease. According to the provided information, cardiovascular (heart and blood vessel) issues are the most common type of long-term diabetes complication. This includes coronary artery disease, heart attack, stroke, and atherosclerosis. These conditions are primarily caused by damage to blood vessels and nerves due to prolonged high blood glucose levels."
28,Diabetes,Which test is commonly used to monitor long-term blood glucose levels?,"{'A': 'Fasting blood glucose test', 'B': 'Random blood glucose test', 'C': 'A1c (HbA1c) test', 'D': 'Oral glucose tolerance test'}",C,"The A1c test provides an average of your blood glucose levels over the past two to three months, helping to monitor long-term control of diabetes.",C,"The correct option is C: A1c (HbA1c) test. This test provides the average blood glucose level over the past two to three months, making it a reliable indicator of long-term blood glucose control. The other options, A: Fasting blood glucose test and B: Random blood glucose test, are more suitable for immediate or short-term blood glucose monitoring. Option D: Oral glucose tolerance test is primarily used for screening and diagnosing gestational diabetes, not for monitoring long-term blood glucose levels."
29,Diabetes,What is the main cause of diabetic ketoacidosis (DKA)?,"{'A': 'Insulin resistance', 'B': 'High blood glucose and lack of insulin', 'C': 'Too much insulin', 'D': 'Pancreatic failure'}",B,"DKA occurs when the body doesn’t have enough insulin to use glucose for energy, leading to fat breakdown and the buildup of acidic ketones in the blood.",B,"The correct option is B: High blood glucose and lack of insulin. Diabetic ketoacidosis (DKA) mainly occurs when there is a lack of insulin in the body, leading to high blood glucose levels. Without enough insulin, the body cannot use glucose for energy, so it breaks down fat instead, releasing ketones that make the blood acidic. This process results in the symptoms of DKA, such as labored breathing, vomiting, and loss of consciousness."
30,Asthma,What is asthma?,"{'A': 'A disease that affects the heart', 'B': 'A disease that affects your lungs', 'C': 'A disease that causes skin rashes', 'D': 'A temporary condition that resolves itself'}",B,"Asthma is a chronic disease that affects the lungs, causing difficulty in breathing.",B,"The correct option is B: A disease that affects your lungs. Asthma is a chronic condition that affects the lungs, causing symptoms such as chest tightness, coughing, shortness of breath, and wheezing. It is not a disease that affects the heart or causes skin rashes, and it is not a temporary condition that resolves itself."
31,Asthma,What is an asthma attack?,"{'A': 'A sudden worsening of asthma symptoms', 'B': 'A sudden improvement in asthma symptoms', 'C': 'A condition where airways become overly relaxed', 'D': 'An allergic reaction affecting the skin'}",A,"An asthma attack occurs when the airways constrict, swell, and produce excess mucus, making breathing difficult.",A,"The correct option is A: A sudden worsening of asthma symptoms. During an asthma attack, the muscles around the airways constrict, the lining of the airways becomes swollen, and there is an increase in mucus production, leading to difficulty in breathing and other symptoms. This aligns with the description provided in the document where it states that during an asthma attack, the airways get tighter, making it difficult to breathe, and it is referred to as an exacerbation or flare-up when asthma is not controlled."
32,Asthma,Which of the following is NOT a type of asthma?,"{'A': 'Exercise-induced asthma', 'B': 'Occupational asthma', 'C': 'Allergic asthma', 'D': 'Cold-induced asthma'}",D,"Cold-induced asthma is not recognized as a distinct type of asthma, although cold air can be a trigger for asthma.",D,"The correct answer is D: Cold-induced asthma. This is because cold-induced asthma is not listed as a type of asthma in the provided text. The types of asthma mentioned in the text are Intermittent, Persistent, Allergic, Non-allergic, Adult-onset, Pediatric, Exercise-induced asthma, Occupational asthma, and Asthma-COPD overlap syndrome (ACOS). Therefore, cold-induced asthma is not a recognized type of asthma based on the information provided."
33,Asthma,Which factor is a common cause of asthma?,"{'A': 'Exposure to mold', 'B': 'Lack of physical activity', 'C': 'Cold weather', 'D': 'Frequent exercise'}",A,"Exposure to mold, among other allergens, is a common environmental trigger that can cause asthma attacks.",A,"The correct option is A: Exposure to mold. According to the provided document, certain factors that present a higher risk of developing asthma include exposure to substances that irritate the airways, such as molds. Mold can be a trigger for asthma attacks, especially for individuals with a dust mite allergy or sensitivity to mold. Therefore, exposure to mold is a common cause of asthma."
34,Asthma,Which of the following is a symptom of asthma?,"{'A': 'Fever', 'B': 'Wheezing', 'C': 'Rashes', 'D': 'Frequent headaches'}",B,"Wheezing, or a high-pitched sound when breathing out, is a common symptom of asthma.",B,"Wheezing is a symptom of asthma. According to the provided document, wheezing is one of the signs and symptoms of asthma. It is a noise your airways make when you breathe out, especially when your airways get tighter during an asthma attack."
35,Asthma,What is the main goal of asthma treatment?,"{'A': 'To cure asthma completely', 'B': 'To control symptoms and prevent attacks', 'C': 'To eliminate the need for medication', 'D': 'To increase lung capacity'}",B,"The goal of asthma treatment is to control symptoms and prevent asthma attacks, not to cure asthma completely.",B,"The correct option is B: To control symptoms and prevent attacks. This is because the main goal of asthma treatment is to manage and control symptoms to prevent asthma attacks. Asthma is a chronic condition that cannot be cured completely, so the focus is on managing symptoms through medications and lifestyle changes to prevent exacerbations."
36,Asthma,What can help prevent an asthma attack?,"{'A': 'Avoiding asthma triggers', 'B': 'Increasing exposure to cold weather', 'C': 'Exercising excessively', 'D': 'Ignoring asthma symptoms'}",A,"Avoiding asthma triggers is key in preventing asthma attacks, as triggers can provoke symptoms and exacerbations.",A,"The correct option is A: Avoiding asthma triggers. This is because triggers such as air pollution, dust mites, exercise, mold, pests, pets, tobacco smoke, strong chemicals, and certain occupational exposures can all lead to asthma attacks. By identifying and avoiding these triggers, individuals with asthma can help prevent attacks and manage their condition effectively."
37,Asthma,What is a peak flow meter used for?,"{'A': 'To measure the temperature of your body', 'B': 'To measure airflow through your lungs', 'C': 'To check blood oxygen levels', 'D': 'To check lung size'}",B,"A peak flow meter measures how fast you can blow air out of your lungs, which helps monitor asthma symptoms and manage treatment.",B,The correct option is B: To measure airflow through your lungs. A peak flow meter is used to measure how fast you can blow air out of your lungs. It helps healthcare providers monitor asthma symptoms and make adjustments to medication based on the airflow measurements.
